
> news-ai-agent@0.1.0 dev
> next dev

   ▲ Next.js 15.1.8
   - Local:        http://localhost:3000
   - Network:      http://192.168.100.204:3000
   - Environments: .env.local
   - Experiments (use with caution):
     · typedRoutes

 ✓ Starting...
 ✓ Ready in 2.2s
 ○ Compiling /test ...
 ✓ Compiled /test in 2.6s (658 modules)
 GET /test 200 in 2493ms
 GET /timeline 200 in 2840ms
 ✓ Compiled /api/timeline in 272ms (661 modules)
 GET /api/timeline?limit=50 200 in 1223ms
 GET /timeline 200 in 53ms
 GET /api/timeline?limit=5 200 in 134ms
 ○ Compiling / ...
 ✓ Compiled / in 1153ms (1693 modules)
 GET / 200 in 1246ms
 ○ Compiling /api/articles ...
 ✓ Compiled /api/articles in 548ms (1701 modules)
 GET /api/sources?withCounts=true&active=true 200 in 848ms
 GET /api/sources?withCounts=true&active=true 200 in 62ms
 GET /api/articles?limit=5 200 in 920ms
 GET /api/timeline 200 in 969ms
 GET /api/articles?limit=5 200 in 117ms
 GET /api/stats 200 in 1044ms
 GET /api/timeline 200 in 157ms
 GET /api/stats 200 in 275ms
 GET /api/timeline 200 in 192ms
 GET /api/analytics/stats?period=30 200 in 1497ms
 GET /api/timeline 200 in 186ms
 GET /api/analytics/stats?period=30 200 in 672ms
 GET /timeline 200 in 52ms
 GET /api/timeline?limit=50 200 in 206ms
 GET /api/timeline?limit=50 200 in 146ms
 ✓ Compiled in 447ms (837 modules)
 GET /timeline 200 in 13ms
 ✓ Compiled in 564ms (1674 modules)
 GET /timeline 200 in 69ms
 ✓ Compiled in 261ms (1674 modules)
 GET /timeline 200 in 42ms
 ✓ Compiled in 362ms (1674 modules)
 GET /timeline 200 in 19ms
 ✓ Compiled in 944ms (1680 modules)
 GET /timeline 200 in 86ms
 ✓ Compiled /api/timeline in 328ms (865 modules)
 GET /api/timeline?limit=3 200 in 529ms
 GET /timeline 200 in 64ms
 GET /timeline 200 in 19ms
 GET /api/timeline?limit=100 200 in 285ms
 GET / 200 in 119ms
 ✓ Compiled /api/articles in 289ms (867 modules)
 ✓ Compiled (873 modules)
 GET /api/stats 200 in 893ms
 GET /api/sources?withCounts=true&active=true 200 in 904ms
 GET /api/timeline 200 in 1093ms
 GET /api/timeline 200 in 193ms
 GET /api/articles?limit=5 200 in 1298ms
 GET /api/analytics/stats?period=30 200 in 1359ms
 GET /timeline 200 in 29ms
 GET /api/timeline?limit=100 200 in 369ms
 GET /api/timeline?limit=100 200 in 157ms
 GET /api/timeline?limit=10 200 in 148ms
 GET / 200 in 12ms
 ✓ Compiled in 1570ms (1707 modules)
 GET /api/sources?withCounts=true&active=true 200 in 1758ms
 GET / 200 in 218ms
 GET /api/sources?withCounts=true&active=true 200 in 54ms
 GET /api/articles?limit=5 200 in 1819ms
 GET /api/timeline 200 in 1837ms
 GET /api/articles?limit=5 200 in 104ms
 GET /api/stats 200 in 1959ms
 GET /api/timeline 200 in 143ms
 GET /api/stats 200 in 61ms
 GET /api/timeline 200 in 193ms
 GET /api/analytics/stats?period=30 200 in 2227ms
 GET /api/timeline 200 in 222ms
 GET /api/analytics/stats?period=30 200 in 478ms
 ✓ Compiled /admin in 372ms (1702 modules)
 GET /admin 200 in 434ms
 ○ Compiling /api/admin/sources ...
 ✓ Compiled /api/admin/sources in 892ms (1708 modules)
 GET /api/admin/conflict-analytics 200 in 964ms
 GET /api/admin/sources 200 in 1002ms
 GET /api/admin/logs 200 in 1009ms
 ✓ Compiled in 451ms (1722 modules)
 GET /admin 200 in 20ms
 ✓ Compiled in 396ms (1722 modules)
 GET /admin 200 in 26ms
 ✓ Compiled in 272ms (1722 modules)
 GET /admin 200 in 18ms
 ✓ Compiled in 289ms (1722 modules)
 GET /admin 200 in 27ms
 ✓ Compiled in 264ms (1722 modules)
 GET /admin 200 in 21ms
 GET /timeline 200 in 76ms
 ✓ Compiled /api/scheduler in 424ms (1712 modules)
 GET /api/scheduler 200 in 475ms
 GET /api/scheduler 200 in 3ms
 GET /timeline 200 in 29ms
 ✓ Compiled in 353ms (1726 modules)
 GET /admin 200 in 26ms
 ✓ Compiled in 352ms (1726 modules)
 GET /admin 200 in 17ms
 GET / 200 in 132ms
 GET /api/sources?withCounts=true&active=true 200 in 74ms
 GET /api/stats 200 in 72ms
 GET /api/articles?limit=5 200 in 147ms
 GET /api/timeline 200 in 205ms
 GET /api/timeline 200 in 137ms
 GET /api/analytics/stats?period=30 200 in 491ms
 ✓ Compiled in 908ms (1720 modules)
 GET / 200 in 674ms
 GET / 200 in 8ms
 GET /timeline 200 in 140ms
 GET /api/timeline?limit=100 200 in 271ms
 GET /api/timeline?limit=100 200 in 157ms
 ○ Compiling /test-timeline ...
 ✓ Compiled /test-timeline in 604ms (1713 modules)
 GET /test-timeline 200 in 669ms
 GET /api/timeline?limit=100 200 in 239ms
 GET /api/timeline?limit=100 200 in 249ms
 GET /api/timeline?limit=100 200 in 187ms
 GET /api/timeline?limit=100 200 in 249ms
 GET /api/timeline?limit=100 200 in 168ms
 GET /api/timeline?limit=1 200 in 130ms
 ✓ Compiled in 697ms (1725 modules)
 GET /timeline 200 in 34ms
 ✓ Compiled in 448ms (1721 modules)
 GET /timeline 200 in 28ms
 GET /api/timeline?limit=100 200 in 235ms
 ✓ Compiled in 370ms (1721 modules)
 GET /timeline 200 in 26ms
 GET /timeline 200 in 26ms
 GET / 200 in 24ms
 GET /api/sources?withCounts=true&active=true 200 in 220ms
 GET /api/stats 200 in 222ms
 GET /api/stats 200 in 47ms
 GET /api/sources?withCounts=true&active=true 200 in 56ms
 GET /api/articles?limit=5 200 in 326ms
 GET /api/timeline 200 in 358ms
 GET /api/articles?limit=5 200 in 93ms
 GET /api/timeline 200 in 138ms
 GET /api/analytics/stats?period=30 200 in 601ms
 GET /api/timeline 200 in 164ms
 GET /api/timeline 200 in 209ms
 GET /api/analytics/stats?period=30 200 in 564ms
 GET /timeline 200 in 13ms
 ✓ Compiled in 760ms (1721 modules)
 GET / 200 in 554ms
 GET / 200 in 5ms
 ✓ Compiled /api/test-date in 309ms (1717 modules)
 GET /api/test-date 200 in 325ms
 ✓ Compiled in 311ms (1726 modules)
 GET / 200 in 26ms
 ✓ Compiled in 407ms (1726 modules)
 GET / 200 in 70ms
 ⨯ ReferenceError: Cannot access 'filteredItems' before initialization
    at filteredItems (components/HorizontalTimeline.tsx:69:52)
  67 |     }
  68 |     console.log('========================')
> 69 |   }, [timelineItems, selectedDate, dayItems.length, filteredItems.length])
     |                                                    ^
  70 |
  71 |   // Apply source filter
  72 |   const filteredItems = dayItems.filter(item => { {
  digest: '795786311'
}
 GET /timeline 500 in 94ms
 ✓ Compiled /thailand-cambodia-research in 474ms (1719 modules)
 GET /thailand-cambodia-research 200 in 523ms
 ⨯ ReferenceError: Cannot access 'filteredItems' before initialization
    at filteredItems (components/HorizontalTimeline.tsx:69:52)
  67 |     }
  68 |     console.log('========================')
> 69 |   }, [timelineItems, selectedDate, dayItems.length, filteredItems.length])
     |                                                    ^
  70 |
  71 |   // Apply source filter
  72 |   const filteredItems = dayItems.filter(item => { {
  digest: '795786311'
}
 GET /timeline 500 in 40ms
 ⨯ ReferenceError: Cannot access 'filteredItems' before initialization
    at filteredItems (components/HorizontalTimeline.tsx:69:52)
  67 |     }
  68 |     console.log('========================')
> 69 |   }, [timelineItems, selectedDate, dayItems.length, filteredItems.length])
     |                                                    ^
  70 |
  71 |   // Apply source filter
  72 |   const filteredItems = dayItems.filter(item => { {
  digest: '795786311'
}
 GET /timeline 500 in 15ms
 ✓ Compiled in 333ms (1721 modules)
 GET /thailand-cambodia-research 200 in 26ms
 ✓ Compiled in 296ms (1696 modules)
 GET /thailand-cambodia-research 200 in 64ms
 ✓ Compiled in 492ms (1696 modules)
 GET /thailand-cambodia-research 200 in 34ms
 GET /timeline 200 in 94ms
 ✓ Compiled in 678ms (1682 modules)
 GET /thailand-cambodia-research 200 in 463ms
 GET /thailand-cambodia-research 200 in 6ms
 ✓ Compiled in 470ms (1680 modules)
 GET /thailand-cambodia-research 200 in 287ms
 GET /thailand-cambodia-research 200 in 6ms
 ✓ Compiled in 478ms (1694 modules)
 GET /thailand-cambodia-research 200 in 45ms
 ✓ Compiled in 286ms (1694 modules)
 GET /thailand-cambodia-research 200 in 23ms
 ○ Compiling /api/timeline ...
 ✓ Compiled /api/timeline in 1757ms (875 modules)
 ✓ Compiled (883 modules)
 GET /api/stats 200 in 2094ms
 GET /api/sources?withCounts=true&active=true 200 in 2102ms
 GET /api/stats 200 in 49ms
 GET /api/sources?withCounts=true&active=true 200 in 55ms
 GET /api/articles?limit=5 200 in 2173ms
 GET /api/timeline 200 in 2229ms
 GET /api/articles?limit=5 200 in 96ms
 GET /api/timeline 200 in 137ms
 GET /api/timeline 200 in 138ms
 GET /api/analytics/stats?period=30 200 in 2540ms
 GET /api/timeline 200 in 137ms
 GET /api/analytics/stats?period=30 200 in 564ms
 GET /thailand-cambodia-research 200 in 89ms
 GET / 200 in 38ms
 GET /api/stats 200 in 391ms
 GET /api/sources?withCounts=true&active=true 200 in 402ms
 GET /api/articles?limit=5 200 in 463ms
 GET /api/stats 200 in 78ms
 GET /api/sources?withCounts=true&active=true 200 in 102ms
 GET /api/timeline 200 in 511ms
 GET /api/articles?limit=5 200 in 132ms
 GET /api/analytics/stats?period=30 200 in 763ms
 GET /api/timeline 200 in 232ms
 GET /api/timeline 200 in 142ms
 GET /api/timeline 200 in 147ms
 GET /api/analytics/stats?period=30 200 in 485ms
 GET /timeline 200 in 334ms
 GET /api/timeline?limit=100 200 in 441ms
 ✓ Compiled in 714ms (1721 modules)
 GET /timeline 200 in 86ms
 GET / 200 in 86ms
 ✓ Compiled in 285ms (1713 modules)
 GET / 200 in 32ms
 GET /timeline 200 in 33ms
 GET / 200 in 17ms
 ✓ Compiled /api/stats in 302ms (875 modules)
 ✓ Compiled (883 modules)
 GET /api/sources?withCounts=true&active=true 200 in 497ms
 GET /api/stats 200 in 497ms
 GET /api/stats 200 in 47ms
 GET /api/sources?withCounts=true&active=true 200 in 56ms
 GET /api/articles?limit=5 200 in 581ms
 GET /api/timeline 200 in 628ms
 GET /api/articles?limit=5 200 in 91ms
 GET /api/timeline 200 in 140ms
 GET /api/timeline 200 in 257ms
 GET /api/analytics/stats?period=30 200 in 1114ms
 GET /api/timeline 200 in 201ms
 GET /api/analytics/stats?period=30 200 in 546ms
 ○ Compiling /conflict-history ...
 ✓ Compiled /conflict-history in 657ms (1761 modules)
 GET /conflict-history 200 in 764ms
 ✓ Compiled /api/admin/scrape-maps in 435ms (1767 modules)
 GET /api/admin/scrape-maps 200 in 712ms
 GET /api/admin/scrape-maps 200 in 3ms
 GET /api/admin/scrape-maps 200 in 3ms
 ⚠ The "images.domains" configuration is deprecated. Please use "images.remotePatterns" configuration instead.
 GET /api/admin/scrape-maps 200 in 19ms
 GET /api/admin/scrape-maps 200 in 6ms
 GET /api/admin/scrape-maps 200 in 3ms
 GET /api/admin/scrape-maps 200 in 3ms
 GET /api/admin/scrape-maps 200 in 5ms
 GET /api/admin/scrape-maps 200 in 3ms
 GET /api/admin/scrape-maps 200 in 3ms
 GET /api/admin/scrape-maps 200 in 3ms
 GET /api/admin/scrape-maps 200 in 2ms
 GET /api/admin/scrape-maps 200 in 2ms
 GET /api/admin/scrape-maps 200 in 2ms
 GET /api/admin/scrape-maps 200 in 2ms
 GET /api/admin/scrape-maps 200 in 2ms
 GET /api/admin/scrape-maps 200 in 2ms
 GET /api/admin/scrape-maps 200 in 6ms
 GET /api/admin/scrape-maps 200 in 7ms
 GET /api/admin/scrape-maps 200 in 3ms
 GET /api/admin/scrape-maps 200 in 3ms
 GET /api/admin/scrape-maps 200 in 3ms
 ✓ Compiled in 567ms (1781 modules)
 GET / 200 in 92ms
 GET /conflict-history 200 in 96ms
 GET /api/stats 200 in 241ms
 GET /api/sources?withCounts=true&active=true 200 in 256ms
 GET /api/stats 200 in 47ms
 GET /api/sources?withCounts=true&active=true 200 in 58ms
 GET /api/articles?limit=5 200 in 333ms
 GET /api/timeline 200 in 387ms
 GET /api/articles?limit=5 200 in 92ms
 GET /api/timeline 200 in 151ms
 GET /api/analytics/stats?period=30 200 in 673ms
 GET /api/timeline 200 in 183ms
 GET /api/timeline 200 in 292ms
 GET /api/analytics/stats?period=30 200 in 708ms
 ○ Compiling /analysis/thai-politics ...
 ✓ Compiled /analysis/thai-politics in 533ms (1786 modules)
 GET /analysis/thai-politics 200 in 673ms
 GET / 200 in 375ms
 GET /api/stats 200 in 81ms
 GET /api/sources?withCounts=true&active=true 200 in 85ms
 GET /api/articles?limit=5 200 in 167ms
 GET /api/timeline 200 in 220ms
 GET /api/timeline 200 in 172ms
 GET /api/analytics/stats?period=30 200 in 501ms
 GET /timeline 200 in 43ms
 GET /api/timeline?limit=100 200 in 249ms
 GET /api/timeline?limit=100 200 in 159ms
 GET /api/timeline?limit=100 200 in 277ms
 GET /api/timeline?limit=100 200 in 236ms
 GET /api/timeline?limit=100 200 in 246ms
 GET /api/timeline?limit=100 200 in 243ms
 GET /api/timeline?limit=100 200 in 158ms
 GET /api/timeline?limit=100 200 in 235ms
 GET /api/timeline?limit=100 200 in 248ms
 GET /api/timeline?limit=100 200 in 251ms
 GET /api/timeline?limit=100 200 in 267ms
 GET /api/timeline?limit=100 200 in 201ms
 GET /api/timeline?limit=100 200 in 187ms
 GET /api/timeline?limit=100 200 in 205ms
 GET /api/timeline?limit=100 200 in 243ms
 GET / 200 in 35ms
 GET /api/stats 200 in 288ms
 GET /api/sources?withCounts=true&active=true 200 in 293ms
 GET /api/stats 200 in 49ms
 GET /api/sources?withCounts=true&active=true 200 in 56ms
 GET /api/articles?limit=5 200 in 376ms
 GET /api/timeline 200 in 472ms
 GET /api/articles?limit=5 200 in 143ms
 GET /api/timeline 200 in 232ms
 GET /api/analytics/stats?period=30 200 in 795ms
 GET /api/timeline 200 in 370ms
 GET /api/timeline 200 in 185ms
 GET /api/analytics/stats?period=30 200 in 588ms
 GET /api/timeline?limit=5 200 in 141ms
 ✓ Compiled in 710ms (1788 modules)
 GET / 200 in 109ms
 GET /analysis/thai-politics 200 in 107ms
 GET / 200 in 20ms
 ✓ Compiled in 455ms (1788 modules)
 GET / 200 in 57ms
 GET /analysis/thai-politics 200 in 58ms
 GET / 200 in 19ms
 ✓ Compiled in 582ms (1788 modules)
 GET / 200 in 66ms
 GET /analysis/thai-politics 200 in 72ms
 GET / 200 in 30ms
 ✓ Compiled in 460ms (1788 modules)
 GET / 200 in 62ms
 GET /analysis/thai-politics 200 in 66ms
 GET / 200 in 48ms
 ✓ Compiled in 499ms (1780 modules)
 GET /analysis/thai-politics 200 in 37ms
 GET / 200 in 39ms
 GET / 200 in 22ms
 ✓ Compiled in 429ms (1780 modules)
 GET / 200 in 55ms
 GET /analysis/thai-politics 200 in 56ms
 GET / 200 in 27ms
 ✓ Compiled in 408ms (1761 modules)
 GET /analysis/thai-politics 200 in 120ms
 GET / 200 in 120ms
 GET / 200 in 11ms
 ✓ Compiled in 287ms (1761 modules)
 GET / 200 in 49ms
 GET /analysis/thai-politics 200 in 52ms
 GET / 200 in 18ms
 ✓ Compiled in 403ms (1761 modules)
 GET / 200 in 40ms
 GET /analysis/thai-politics 200 in 42ms
 GET / 200 in 18ms
 ✓ Compiled in 1224ms (1761 modules)
 GET / 200 in 119ms
 GET /analysis/thai-politics 200 in 120ms
 GET / 200 in 27ms
 ○ Compiling /api/stats ...
 ✓ Compiled /api/stats in 895ms (909 modules)
 ✓ Compiled (911 modules)
 GET /api/stats 200 in 1109ms
 GET /api/stats 200 in 45ms
 GET /api/articles?limit=5 200 in 1214ms
 GET /api/articles?limit=5 200 in 133ms
 ✓ Compiled in 215ms (871 modules)
 GET / 200 in 62ms
 GET /analysis/thai-politics 200 in 63ms
 GET / 200 in 24ms
 ✓ Compiled in 153ms (871 modules)
 GET / 200 in 183ms
 GET /analysis/thai-politics 200 in 249ms
 ✓ Compiled in 306ms (871 modules)
 GET / 200 in 166ms
 GET /analysis/thai-politics 200 in 51ms
 GET / 200 in 61ms
 GET / 200 in 35ms
 ✓ Compiled in 334ms (871 modules)
 ⨯ ./app/admin/page.tsx
Error:   [31mx[0m Unexpected token `AdminAuth`. Expected jsx identifier
     ,-[[36;1;4m/Users/sochetra/Claude ME/NewsAIAgent/app/admin/page.tsx[0m:255:1]
 [2m252[0m |   }
 [2m253[0m | 
 [2m254[0m |   return (
 [2m255[0m |     <AdminAuth>
     : [35;1m     ^^^^^^^^^[0m
 [2m256[0m |     <div className="min-h-screen bg-gray-50">
 [2m257[0m |       <header className="bg-white shadow-sm border-b">
 [2m258[0m |         <div className="max-w-7xl mx-auto px-4 sm:px-6 lg:px-8">
     `----

Caused by:
    Syntax Error

Import trace for requested module:
./app/admin/page.tsx
 GET /analysis/thai-politics 200 in 204ms
 GET / 200 in 207ms
 ○ Compiling /_error ...
 ⨯ ./app/admin/page.tsx
Error:   [31mx[0m Unexpected token `AdminAuth`. Expected jsx identifier
     ,-[[36;1;4m/Users/sochetra/Claude ME/NewsAIAgent/app/admin/page.tsx[0m:255:1]
 [2m252[0m |   }
 [2m253[0m | 
 [2m254[0m |   return (
 [2m255[0m |     <AdminAuth>
     : [35;1m     ^^^^^^^^^[0m
 [2m256[0m |     <div className="min-h-screen bg-gray-50">
 [2m257[0m |       <header className="bg-white shadow-sm border-b">
 [2m258[0m |         <div className="max-w-7xl mx-auto px-4 sm:px-6 lg:px-8">
     `----

Caused by:
    Syntax Error

Import trace for requested module:
./app/admin/page.tsx
 GET / 500 in 1295ms
 GET /analysis/thai-politics 500 in 536ms
 GET / 500 in 10ms
 GET /analysis/thai-politics 500 in 8ms
 GET / 500 in 10ms
 GET / 500 in 6ms
 GET /analysis/thai-politics 500 in 18ms
 GET / 500 in 19ms
 GET / 500 in 6ms
 GET / 500 in 15ms
 ✓ Compiled /_error in 550ms (1066 modules)
 ○ Compiling /_not-found ...
 ✓ Compiled /_not-found in 612ms (2009 modules)
 ⚠ Fast Refresh had to perform a full reload. Read more: https://nextjs.org/docs/messages/fast-refresh-reload
 ⚠ Fast Refresh had to perform a full reload. Read more: https://nextjs.org/docs/messages/fast-refresh-reload
 GET /_next/static/webpack/6c5b0effa61d0645.webpack.hot-update.json 404 in 863ms
 GET / 200 in 871ms
 GET /analysis/thai-politics 200 in 870ms
 ⚠ Fast Refresh had to perform a full reload. Read more: https://nextjs.org/docs/messages/fast-refresh-reload
 GET /_next/static/webpack/6c5b0effa61d0645.webpack.hot-update.json 404 in 108ms
 GET / 200 in 123ms
 ✓ Compiled /api/timeline in 205ms (959 modules)
 ✓ Compiled (963 modules)
 GET /api/stats 200 in 469ms
 GET /api/sources?withCounts=true&active=true 200 in 483ms
 GET /api/stats 200 in 46ms
 GET /api/sources?withCounts=true&active=true 200 in 56ms
 GET /api/articles?limit=5 200 in 559ms
 GET /api/timeline 200 in 606ms
 GET /api/articles?limit=5 200 in 89ms
 GET /api/timeline 200 in 136ms
 GET /api/timeline 200 in 136ms
 GET /api/analytics/stats?period=30 200 in 892ms
 GET /api/timeline 200 in 136ms
 GET /api/analytics/stats?period=30 200 in 462ms
   Reload env: .env.local
 ⚠ Fast Refresh had to perform a full reload. Read more: https://nextjs.org/docs/messages/fast-refresh-reload
 ⚠ Fast Refresh had to perform a full reload. Read more: https://nextjs.org/docs/messages/fast-refresh-reload
 ⚠ Fast Refresh had to perform a full reload. Read more: https://nextjs.org/docs/messages/fast-refresh-reload
 ✓ Compiled in 4.7s (2029 modules)
 GET /analysis/thai-politics 200 in 260ms
 GET / 200 in 2299ms
 GET /analysis/thai-politics 200 in 2382ms
 GET / 200 in 390ms
 GET / 200 in 151ms
 GET /api/stats 200 in 75ms
 GET /api/sources?withCounts=true&active=true 200 in 78ms
 GET /api/stats 200 in 48ms
 GET /api/sources?withCounts=true&active=true 200 in 97ms
 GET /api/articles?limit=5 200 in 181ms
 GET /api/timeline 200 in 642ms
 GET /api/articles?limit=5 200 in 165ms
 GET /api/timeline 200 in 216ms
 GET /api/analytics/stats?period=30 200 in 905ms
 GET /api/timeline 200 in 175ms
 GET /api/timeline 200 in 138ms
 GET /api/analytics/stats?period=30 200 in 795ms
 ✓ Compiled in 3s (1066 modules)
 GET / 200 in 25ms
 GET /analysis/thai-politics 200 in 26ms
 GET / 200 in 16ms
 GET /timeline 200 in 24ms
 GET /api/timeline?limit=100 200 in 346ms
 GET /api/timeline?limit=100 200 in 242ms
 GET /api/timeline?limit=100 200 in 247ms
 GET /api/timeline?limit=100 200 in 240ms
 GET /api/timeline?limit=100 200 in 238ms
 GET /api/timeline?limit=100 200 in 230ms
 GET /api/timeline?limit=100 200 in 260ms
 ✓ Compiled in 842ms (2015 modules)
 GET /timeline 200 in 647ms
 GET /analysis/thai-politics 200 in 648ms
 GET / 200 in 662ms
 GET /timeline 200 in 16ms
 GET /analysis/thai-politics 200 in 17ms
 GET / 200 in 15ms
 GET /api/timeline?limit=100 200 in 255ms
 ✓ Compiled in 534ms (2026 modules)
 GET /timeline 200 in 94ms
 GET / 200 in 95ms
 GET /analysis/thai-politics 200 in 95ms
 GET /api/stats 200 in 83ms
 GET /api/articles?limit=5 200 in 170ms
 GET /api/timeline?limit=10 200 in 147ms
 GET / 200 in 101ms
 GET /api/stats 200 in 130ms
 GET /api/sources?withCounts=true&active=true 200 in 134ms
 GET /api/stats 200 in 48ms
 GET /api/sources?withCounts=true&active=true 200 in 58ms
 GET /api/articles?limit=5 200 in 217ms
 GET /api/timeline 200 in 269ms
 GET /api/articles?limit=5 200 in 107ms
 GET /api/timeline 200 in 146ms
 GET /api/analytics/stats?period=30 200 in 542ms
 GET /api/timeline 200 in 178ms
 GET /api/timeline 200 in 137ms
 GET /api/analytics/stats?period=30 200 in 467ms
 ○ Compiling /timeline-2025 ...
 ✓ Compiled /timeline-2025 in 1071ms (2027 modules)
 GET /timeline-2025 200 in 1153ms
 ✓ Compiled in 529ms (2041 modules)
 GET /timeline-2025 200 in 56ms
 GET / 200 in 57ms
 GET /timeline 200 in 59ms
 ✓ Compiled in 626ms (2036 modules)
 GET /timeline-2025 200 in 65ms
 GET /timeline 200 in 68ms
 GET / 200 in 73ms
 ✓ Compiled in 413ms (2036 modules)
 GET /timeline-2025 200 in 70ms
 GET / 200 in 71ms
 GET /timeline 200 in 71ms
 ✓ Compiled in 824ms (2036 modules)
 GET /timeline 200 in 52ms
 GET /timeline-2025 200 in 52ms
 GET / 200 in 53ms
 ✓ Compiled in 768ms (2036 modules)
 GET /timeline-2025 200 in 122ms
 GET /timeline 200 in 132ms
 GET / 200 in 134ms
 GET / 200 in 45ms
 GET /api/sources?withCounts=true&active=true 200 in 275ms
 GET /api/stats 200 in 201ms
 GET /api/articles?limit=5 200 in 314ms
 GET /api/timeline 200 in 468ms
 GET /api/sources?withCounts=true&active=true 200 in 337ms
 GET /api/stats 200 in 395ms
 GET /api/analytics/stats?period=30 200 in 860ms
 GET /api/articles?limit=5 200 in 374ms
 GET /api/timeline 200 in 347ms
 GET /api/timeline 200 in 224ms
 GET /api/timeline 200 in 186ms
 GET /api/analytics/stats?period=30 200 in 543ms
 GET /timeline 200 in 39ms
 GET /api/timeline?limit=100 200 in 318ms
 GET /api/timeline?limit=100 200 in 247ms
 GET /api/timeline?limit=100 200 in 321ms
 GET /api/timeline?limit=100 200 in 244ms
 GET /api/timeline?limit=100 200 in 228ms
 GET /api/timeline?limit=100 200 in 233ms
 GET /api/timeline?limit=100 200 in 232ms
 ✓ Compiled in 906ms (2028 modules)
 GET /timeline 200 in 71ms
 GET / 200 in 72ms
 GET /timeline 200 in 32ms
 ✓ Compiled in 501ms (2028 modules)
 GET /timeline 200 in 91ms
 GET / 200 in 98ms
 GET /timeline 200 in 93ms
 GET /timeline 200 in 121ms
 GET /api/timeline?limit=100 200 in 270ms
 ✓ Compiled in 812ms (2009 modules)
 GET / 200 in 75ms
 GET /timeline 200 in 75ms
 GET /timeline 200 in 8ms
 ✓ Compiled in 590ms (2009 modules)
 GET /timeline 200 in 63ms
 GET / 200 in 63ms
 GET /timeline 200 in 43ms
 ✓ Compiled in 429ms (2009 modules)
 GET /timeline 200 in 40ms
 GET / 200 in 43ms
 GET /timeline 200 in 28ms
 ✓ Compiled in 511ms (2009 modules)
 GET /timeline 200 in 82ms
 GET / 200 in 90ms
 GET /timeline 200 in 52ms
 ✓ Compiled in 550ms (2009 modules)
 GET / 200 in 48ms
 GET /timeline 200 in 52ms
 GET /timeline 200 in 29ms
 ✓ Compiled in 540ms (2009 modules)
 GET /timeline 200 in 41ms
 GET / 200 in 40ms
 GET /timeline 200 in 29ms
 ✓ Compiled in 504ms (2009 modules)
 GET /timeline 200 in 64ms
 GET / 200 in 72ms
 GET /timeline 200 in 94ms
 GET /timeline 200 in 43ms
 ✓ Compiled /api/timeline in 355ms (957 modules)
 GET /api/timeline?limit=100 200 in 657ms
 GET /timeline 200 in 141ms
 GET /api/timeline?limit=100 200 in 247ms
 GET / 200 in 23ms
 ✓ Compiled /api/articles in 315ms (959 modules)
 ✓ Compiled (965 modules)
 GET /api/stats 200 in 551ms
 GET /api/sources?withCounts=true&active=true 200 in 555ms
 GET /api/stats 200 in 48ms
 GET /api/sources?withCounts=true&active=true 200 in 57ms
 GET /api/articles?limit=5 200 in 636ms
 GET /api/timeline 200 in 759ms
 GET /api/articles?limit=5 200 in 157ms
 GET /api/timeline 200 in 246ms
 GET /api/analytics/stats?period=30 200 in 1142ms
 GET /api/timeline 200 in 286ms
 GET /timeline-2025 200 in 147ms
 GET /api/timeline 200 in 210ms
 GET /api/analytics/stats?period=30 200 in 656ms
 GET / 200 in 296ms
 ✓ Compiled /admin in 480ms (945 modules)
 GET /admin 200 in 585ms
 ✓ Compiled /api/admin/conflict-analytics in 325ms (964 modules)
 ✓ Compiled in 0ms (968 modules)
 ✓ Compiled in 0ms (968 modules)
 ✓ Compiled in 0ms (968 modules)
 GET /api/admin/logs 200 in 1058ms
 GET /timeline-2025 200 in 763ms
 GET / 200 in 764ms
 GET /admin 200 in 767ms
 GET / 200 in 17ms
 GET /api/admin/conflict-analytics 200 in 1199ms
 GET /timeline-2025 200 in 39ms
 GET /admin 200 in 40ms
 GET /api/admin/sources 200 in 1302ms
 ✓ Compiled in 786ms (2014 modules)
 GET / 200 in 98ms
 GET /admin 200 in 98ms
 GET /timeline-2025 200 in 98ms
 ✓ Compiled in 1312ms (1991 modules)
 ⨯ Error: Cannot find module './638.js'
Require stack:
- /Users/sochetra/Claude ME/NewsAIAgent/.next/server/webpack-runtime.js
- /Users/sochetra/Claude ME/NewsAIAgent/.next/server/app/admin/page.js
- /Users/sochetra/Claude ME/NewsAIAgent/node_modules/next/dist/server/require.js
- /Users/sochetra/Claude ME/NewsAIAgent/node_modules/next/dist/server/load-components.js
- /Users/sochetra/Claude ME/NewsAIAgent/node_modules/next/dist/build/utils.js
- /Users/sochetra/Claude ME/NewsAIAgent/node_modules/next/dist/build/swc/options.js
- /Users/sochetra/Claude ME/NewsAIAgent/node_modules/next/dist/build/swc/index.js
- /Users/sochetra/Claude ME/NewsAIAgent/node_modules/next/dist/build/analysis/parse-module.js
- /Users/sochetra/Claude ME/NewsAIAgent/node_modules/next/dist/build/analysis/get-page-static-info.js
- /Users/sochetra/Claude ME/NewsAIAgent/node_modules/next/dist/server/lib/router-utils/setup-dev-bundler.js
- /Users/sochetra/Claude ME/NewsAIAgent/node_modules/next/dist/server/lib/router-server.js
- /Users/sochetra/Claude ME/NewsAIAgent/node_modules/next/dist/server/lib/start-server.js
    at __webpack_require__.f.require (.next/server/webpack-runtime.js:198:28)
    at <unknown> (.next/server/webpack-runtime.js:111:40)
    at Array.reduce (<anonymous>)
    at __webpack_require__.e (.next/server/webpack-runtime.js:110:67)
    at Array.map (<anonymous>)
    at __webpack_require__.X (.next/server/webpack-runtime.js:162:22)
    at <unknown> (.next/server/app/admin/page.js:1:29635)
    at Object.<anonymous> (.next/server/app/admin/page.js:1:29688) {
  code: 'MODULE_NOT_FOUND',
  requireStack: [Array],
  page: '/admin'
}
 ⨯ Error: Cannot find module './638.js'
Require stack:
- /Users/sochetra/Claude ME/NewsAIAgent/.next/server/webpack-runtime.js
- /Users/sochetra/Claude ME/NewsAIAgent/.next/server/app/admin/page.js
- /Users/sochetra/Claude ME/NewsAIAgent/node_modules/next/dist/server/require.js
- /Users/sochetra/Claude ME/NewsAIAgent/node_modules/next/dist/server/load-components.js
- /Users/sochetra/Claude ME/NewsAIAgent/node_modules/next/dist/build/utils.js
- /Users/sochetra/Claude ME/NewsAIAgent/node_modules/next/dist/build/swc/options.js
- /Users/sochetra/Claude ME/NewsAIAgent/node_modules/next/dist/build/swc/index.js
- /Users/sochetra/Claude ME/NewsAIAgent/node_modules/next/dist/build/analysis/parse-module.js
- /Users/sochetra/Claude ME/NewsAIAgent/node_modules/next/dist/build/analysis/get-page-static-info.js
- /Users/sochetra/Claude ME/NewsAIAgent/node_modules/next/dist/server/lib/router-utils/setup-dev-bundler.js
- /Users/sochetra/Claude ME/NewsAIAgent/node_modules/next/dist/server/lib/router-server.js
- /Users/sochetra/Claude ME/NewsAIAgent/node_modules/next/dist/server/lib/start-server.js
    at __webpack_require__.f.require (.next/server/webpack-runtime.js:198:28)
    at <unknown> (.next/server/webpack-runtime.js:111:40)
    at Array.reduce (<anonymous>)
    at __webpack_require__.e (.next/server/webpack-runtime.js:110:67)
    at Array.map (<anonymous>)
    at __webpack_require__.X (.next/server/webpack-runtime.js:162:22)
    at <unknown> (.next/server/app/page.js:1:403198)
    at Object.<anonymous> (.next/server/app/page.js:1:403250) {
  code: 'MODULE_NOT_FOUND',
  requireStack: [Array],
  page: '/'
}
 GET /timeline-2025 200 in 317ms
 ○ Compiling /_error ...
 ✓ Compiled /_not-found in 674ms (1979 modules)
 ✓ Compiled (1982 modules)
 ⨯ Error: Cannot find module './627.js'
Require stack:
- /Users/sochetra/Claude ME/NewsAIAgent/.next/server/webpack-runtime.js
- /Users/sochetra/Claude ME/NewsAIAgent/.next/server/pages/_document.js
- /Users/sochetra/Claude ME/NewsAIAgent/node_modules/next/dist/server/require.js
- /Users/sochetra/Claude ME/NewsAIAgent/node_modules/next/dist/server/load-components.js
- /Users/sochetra/Claude ME/NewsAIAgent/node_modules/next/dist/build/utils.js
- /Users/sochetra/Claude ME/NewsAIAgent/node_modules/next/dist/build/swc/options.js
- /Users/sochetra/Claude ME/NewsAIAgent/node_modules/next/dist/build/swc/index.js
- /Users/sochetra/Claude ME/NewsAIAgent/node_modules/next/dist/build/analysis/parse-module.js
- /Users/sochetra/Claude ME/NewsAIAgent/node_modules/next/dist/build/analysis/get-page-static-info.js
- /Users/sochetra/Claude ME/NewsAIAgent/node_modules/next/dist/server/lib/router-utils/setup-dev-bundler.js
- /Users/sochetra/Claude ME/NewsAIAgent/node_modules/next/dist/server/lib/router-server.js
- /Users/sochetra/Claude ME/NewsAIAgent/node_modules/next/dist/server/lib/start-server.js
    at __webpack_require__.f.require (.next/server/webpack-runtime.js:198:28)
    at <unknown> (.next/server/webpack-runtime.js:111:40)
    at Array.reduce (<anonymous>)
    at __webpack_require__.e (.next/server/webpack-runtime.js:110:67)
    at Array.map (<anonymous>)
    at __webpack_require__.X (.next/server/webpack-runtime.js:162:22)
    at <unknown> (.next/server/pages/_document.js:1:339)
    at Object.<anonymous> (.next/server/pages/_document.js:1:381) {
  code: 'MODULE_NOT_FOUND',
  requireStack: [Array]
}
 ⨯ Error: Cannot find module './627.js'
Require stack:
- /Users/sochetra/Claude ME/NewsAIAgent/.next/server/webpack-runtime.js
- /Users/sochetra/Claude ME/NewsAIAgent/.next/server/pages/_document.js
- /Users/sochetra/Claude ME/NewsAIAgent/node_modules/next/dist/server/require.js
- /Users/sochetra/Claude ME/NewsAIAgent/node_modules/next/dist/server/load-components.js
- /Users/sochetra/Claude ME/NewsAIAgent/node_modules/next/dist/build/utils.js
- /Users/sochetra/Claude ME/NewsAIAgent/node_modules/next/dist/build/swc/options.js
- /Users/sochetra/Claude ME/NewsAIAgent/node_modules/next/dist/build/swc/index.js
- /Users/sochetra/Claude ME/NewsAIAgent/node_modules/next/dist/build/analysis/parse-module.js
- /Users/sochetra/Claude ME/NewsAIAgent/node_modules/next/dist/build/analysis/get-page-static-info.js
- /Users/sochetra/Claude ME/NewsAIAgent/node_modules/next/dist/server/lib/router-utils/setup-dev-bundler.js
- /Users/sochetra/Claude ME/NewsAIAgent/node_modules/next/dist/server/lib/router-server.js
- /Users/sochetra/Claude ME/NewsAIAgent/node_modules/next/dist/server/lib/start-server.js
    at __webpack_require__.f.require (.next/server/webpack-runtime.js:198:28)
    at <unknown> (.next/server/webpack-runtime.js:111:40)
    at Array.reduce (<anonymous>)
    at __webpack_require__.e (.next/server/webpack-runtime.js:110:67)
    at Array.map (<anonymous>)
    at __webpack_require__.X (.next/server/webpack-runtime.js:162:22)
    at <unknown> (.next/server/pages/_document.js:1:339)
    at Object.<anonymous> (.next/server/pages/_document.js:1:381) {
  code: 'MODULE_NOT_FOUND',
  requireStack: [Array]
}
 GET / 500 in 1234ms
 GET /admin 500 in 1234ms
 GET /_next/static/css/app/layout.css?v=1753728718563 404 in 560ms
 ⨯ Error: Cannot find module './638.js'
Require stack:
- /Users/sochetra/Claude ME/NewsAIAgent/.next/server/webpack-runtime.js
- /Users/sochetra/Claude ME/NewsAIAgent/.next/server/pages/_document.js
- /Users/sochetra/Claude ME/NewsAIAgent/node_modules/next/dist/server/require.js
- /Users/sochetra/Claude ME/NewsAIAgent/node_modules/next/dist/server/load-components.js
- /Users/sochetra/Claude ME/NewsAIAgent/node_modules/next/dist/build/utils.js
- /Users/sochetra/Claude ME/NewsAIAgent/node_modules/next/dist/build/swc/options.js
- /Users/sochetra/Claude ME/NewsAIAgent/node_modules/next/dist/build/swc/index.js
- /Users/sochetra/Claude ME/NewsAIAgent/node_modules/next/dist/build/analysis/parse-module.js
- /Users/sochetra/Claude ME/NewsAIAgent/node_modules/next/dist/build/analysis/get-page-static-info.js
- /Users/sochetra/Claude ME/NewsAIAgent/node_modules/next/dist/server/lib/router-utils/setup-dev-bundler.js
- /Users/sochetra/Claude ME/NewsAIAgent/node_modules/next/dist/server/lib/router-server.js
- /Users/sochetra/Claude ME/NewsAIAgent/node_modules/next/dist/server/lib/start-server.js
    at __webpack_require__.f.require (.next/server/webpack-runtime.js:198:28)
    at <unknown> (.next/server/webpack-runtime.js:111:40)
    at Array.reduce (<anonymous>)
    at __webpack_require__.e (.next/server/webpack-runtime.js:110:67)
    at Array.map (<anonymous>)
    at __webpack_require__.X (.next/server/webpack-runtime.js:162:22)
    at <unknown> (.next/server/app/admin/page.js:1:29635)
    at Object.<anonymous> (.next/server/app/admin/page.js:1:29688) {
  code: 'MODULE_NOT_FOUND',
  requireStack: [Array],
  page: '/admin'
}
 ⨯ Error: Cannot find module './638.js'
Require stack:
- /Users/sochetra/Claude ME/NewsAIAgent/.next/server/webpack-runtime.js
- /Users/sochetra/Claude ME/NewsAIAgent/.next/server/pages/_document.js
- /Users/sochetra/Claude ME/NewsAIAgent/node_modules/next/dist/server/require.js
- /Users/sochetra/Claude ME/NewsAIAgent/node_modules/next/dist/server/load-components.js
- /Users/sochetra/Claude ME/NewsAIAgent/node_modules/next/dist/build/utils.js
- /Users/sochetra/Claude ME/NewsAIAgent/node_modules/next/dist/build/swc/options.js
- /Users/sochetra/Claude ME/NewsAIAgent/node_modules/next/dist/build/swc/index.js
- /Users/sochetra/Claude ME/NewsAIAgent/node_modules/next/dist/build/analysis/parse-module.js
- /Users/sochetra/Claude ME/NewsAIAgent/node_modules/next/dist/build/analysis/get-page-static-info.js
- /Users/sochetra/Claude ME/NewsAIAgent/node_modules/next/dist/server/lib/router-utils/setup-dev-bundler.js
- /Users/sochetra/Claude ME/NewsAIAgent/node_modules/next/dist/server/lib/router-server.js
- /Users/sochetra/Claude ME/NewsAIAgent/node_modules/next/dist/server/lib/start-server.js
    at __webpack_require__.f.require (.next/server/webpack-runtime.js:198:28)
    at <unknown> (.next/server/webpack-runtime.js:111:40)
    at Array.reduce (<anonymous>)
    at __webpack_require__.e (.next/server/webpack-runtime.js:110:67)
    at Array.map (<anonymous>)
    at __webpack_require__.X (.next/server/webpack-runtime.js:162:22)
    at <unknown> (.next/server/app/page.js:1:403198)
    at Object.<anonymous> (.next/server/app/page.js:1:403250) {
  code: 'MODULE_NOT_FOUND',
  requireStack: [Array],
  page: '/'
}
 ⨯ Error: Cannot find module './627.js'
Require stack:
- /Users/sochetra/Claude ME/NewsAIAgent/.next/server/webpack-runtime.js
- /Users/sochetra/Claude ME/NewsAIAgent/.next/server/pages/_document.js
- /Users/sochetra/Claude ME/NewsAIAgent/node_modules/next/dist/server/require.js
- /Users/sochetra/Claude ME/NewsAIAgent/node_modules/next/dist/server/load-components.js
- /Users/sochetra/Claude ME/NewsAIAgent/node_modules/next/dist/build/utils.js
- /Users/sochetra/Claude ME/NewsAIAgent/node_modules/next/dist/build/swc/options.js
- /Users/sochetra/Claude ME/NewsAIAgent/node_modules/next/dist/build/swc/index.js
- /Users/sochetra/Claude ME/NewsAIAgent/node_modules/next/dist/build/analysis/parse-module.js
- /Users/sochetra/Claude ME/NewsAIAgent/node_modules/next/dist/build/analysis/get-page-static-info.js
- /Users/sochetra/Claude ME/NewsAIAgent/node_modules/next/dist/server/lib/router-utils/setup-dev-bundler.js
- /Users/sochetra/Claude ME/NewsAIAgent/node_modules/next/dist/server/lib/router-server.js
- /Users/sochetra/Claude ME/NewsAIAgent/node_modules/next/dist/server/lib/start-server.js
    at __webpack_require__.f.require (.next/server/webpack-runtime.js:198:28)
    at <unknown> (.next/server/webpack-runtime.js:111:40)
    at Array.reduce (<anonymous>)
    at __webpack_require__.e (.next/server/webpack-runtime.js:110:67)
    at Array.map (<anonymous>)
    at __webpack_require__.X (.next/server/webpack-runtime.js:162:22)
    at <unknown> (.next/server/pages/_document.js:1:339)
    at Object.<anonymous> (.next/server/pages/_document.js:1:381) {
  code: 'MODULE_NOT_FOUND',
  requireStack: [Array]
}
 ⨯ Error: Cannot find module './627.js'
Require stack:
- /Users/sochetra/Claude ME/NewsAIAgent/.next/server/webpack-runtime.js
- /Users/sochetra/Claude ME/NewsAIAgent/.next/server/pages/_document.js
- /Users/sochetra/Claude ME/NewsAIAgent/node_modules/next/dist/server/require.js
- /Users/sochetra/Claude ME/NewsAIAgent/node_modules/next/dist/server/load-components.js
- /Users/sochetra/Claude ME/NewsAIAgent/node_modules/next/dist/build/utils.js
- /Users/sochetra/Claude ME/NewsAIAgent/node_modules/next/dist/build/swc/options.js
- /Users/sochetra/Claude ME/NewsAIAgent/node_modules/next/dist/build/swc/index.js
- /Users/sochetra/Claude ME/NewsAIAgent/node_modules/next/dist/build/analysis/parse-module.js
- /Users/sochetra/Claude ME/NewsAIAgent/node_modules/next/dist/build/analysis/get-page-static-info.js
- /Users/sochetra/Claude ME/NewsAIAgent/node_modules/next/dist/server/lib/router-utils/setup-dev-bundler.js
- /Users/sochetra/Claude ME/NewsAIAgent/node_modules/next/dist/server/lib/router-server.js
- /Users/sochetra/Claude ME/NewsAIAgent/node_modules/next/dist/server/lib/start-server.js
    at __webpack_require__.f.require (.next/server/webpack-runtime.js:198:28)
    at <unknown> (.next/server/webpack-runtime.js:111:40)
    at Array.reduce (<anonymous>)
    at __webpack_require__.e (.next/server/webpack-runtime.js:110:67)
    at Array.map (<anonymous>)
    at __webpack_require__.X (.next/server/webpack-runtime.js:162:22)
    at <unknown> (.next/server/pages/_document.js:1:339)
    at Object.<anonymous> (.next/server/pages/_document.js:1:381) {
  code: 'MODULE_NOT_FOUND',
  requireStack: [Array]
}
 GET /admin 500 in 616ms
 GET / 500 in 617ms
 GET /_next/static/chunks/fallback/webpack.js 404 in 73ms
 GET /_next/static/chunks/fallback/react-refresh.js 404 in 76ms
 GET /_next/static/chunks/fallback/webpack.js 404 in 77ms
 GET /_next/static/chunks/fallback/main.js 404 in 78ms
 GET /_next/static/chunks/fallback/pages/_app.js 404 in 71ms
 GET /_next/static/chunks/fallback/react-refresh.js 404 in 73ms
 GET /_next/static/chunks/fallback/main.js 404 in 76ms
 GET /_next/static/chunks/fallback/pages/_error.js 404 in 49ms
 GET /_next/static/chunks/fallback/pages/_app.js 404 in 34ms
 GET /_next/static/chunks/fallback/pages/_error.js 404 in 48ms
 ✓ Compiled in 616ms (1996 modules)
 GET /timeline-2025 200 in 23ms
 GET /_next/static/css/app/layout.css?v=1753728724533 404 in 24ms
 ⚠ Found a change in next.config.mjs. Restarting the server to apply the changes...
   ▲ Next.js 15.1.8
   - Local:        http://localhost:3000
   - Network:      http://192.168.100.204:3000
   - Environments: .env.local
   - Experiments (use with caution):
     · typedRoutes

 ✓ Starting...
 ✓ Ready in 2.1s
 ○ Compiling /timeline-2025 ...
 ✓ Compiled /timeline-2025 in 2.3s (655 modules)
 ✓ Compiled in 485ms (322 modules)
 GET /timeline-2025 200 in 200ms
 GET /timeline-2025 200 in 71ms
 ○ Compiling /_not-found ...
 ✓ Compiled /_not-found in 561ms (645 modules)
 ○ Compiling / ...
 ✓ Compiled / in 2.5s (1690 modules)
 ✓ Compiled /analysis/thai-politics in 485ms (1709 modules)
 GET /analysis/thai-politics 200 in 545ms
 GET / 200 in 869ms
 GET / 200 in 200ms
 ○ Compiling /api/timeline ...
 ✓ Compiled /api/timeline in 1987ms (1714 modules)
Articles API error: Error [PrismaClientKnownRequestError]: 
Invalid `prisma.article.count()` invocation:


Raw query failed. Code: `unknown`. Message: `Kind: Server selection timeout: No available servers. Topology: { Type: ReplicaSetNoPrimary, Set Name: atlas-r0e67z-shard-0, Servers: [ { Address: ac-fcgifqm-shard-00-02.fcvhot7.mongodb.net:27017, Type: Unknown, Error: Kind: I/O error: received fatal alert: InternalError, labels: {} }, { Address: ac-fcgifqm-shard-00-01.fcvhot7.mongodb.net:27017, Type: Unknown, Error: Kind: I/O error: received fatal alert: InternalError, labels: {} }, { Address: ac-fcgifqm-shard-00-00.fcvhot7.mongodb.net:27017, Type: Unknown, Error: Kind: I/O error: received fatal alert: InternalError, labels: {} } ] }, labels: {}`
    at async GET (app/api/articles/route.ts:51:30)
  49 |     }
  50 |
> 51 |     const [articles, total] = await Promise.all([
     |                              ^
  52 |       prisma.article.findMany({
  53 |         where: whereClause,
  54 |         include: { {
  code: 'P2010',
  clientVersion: '5.22.0',
  meta: [Object]
}
 GET /api/articles?limit=5 500 in 32980ms
Timeline API error: Error [PrismaClientKnownRequestError]: 
Invalid `prisma.timelineEvent.findMany()` invocation:


Raw query failed. Code: `unknown`. Message: `Kind: Server selection timeout: No available servers. Topology: { Type: ReplicaSetNoPrimary, Set Name: atlas-r0e67z-shard-0, Servers: [ { Address: ac-fcgifqm-shard-00-02.fcvhot7.mongodb.net:27017, Type: Unknown, Error: Kind: I/O error: received fatal alert: InternalError, labels: {} }, { Address: ac-fcgifqm-shard-00-01.fcvhot7.mongodb.net:27017, Type: Unknown, Error: Kind: I/O error: received fatal alert: InternalError, labels: {} }, { Address: ac-fcgifqm-shard-00-00.fcvhot7.mongodb.net:27017, Type: Unknown, Error: Kind: I/O error: received fatal alert: InternalError, labels: {} } ] }, labels: {}`
    at async GET (app/api/timeline/route.ts:36:27)
  34 |     }
  35 |
> 36 |     const timelineEvents = await prisma.timelineEvent.findMany({
     |                           ^
  37 |       where: whereClause,
  38 |       include: {
  39 |         article: { {
  code: 'P2010',
  clientVersion: '5.22.0',
  meta: [Object]
}
 GET /api/timeline 500 in 33016ms
Sources API error: Error [PrismaClientKnownRequestError]: 
Invalid `prisma.source.findMany()` invocation:


Raw query failed. Code: `unknown`. Message: `Kind: Server selection timeout: No available servers. Topology: { Type: ReplicaSetNoPrimary, Set Name: atlas-r0e67z-shard-0, Servers: [ { Address: ac-fcgifqm-shard-00-02.fcvhot7.mongodb.net:27017, Type: Unknown, Error: Kind: I/O error: received fatal alert: InternalError, labels: {} }, { Address: ac-fcgifqm-shard-00-01.fcvhot7.mongodb.net:27017, Type: Unknown, Error: Kind: I/O error: received fatal alert: InternalError, labels: {} }, { Address: ac-fcgifqm-shard-00-00.fcvhot7.mongodb.net:27017, Type: Unknown, Error: Kind: I/O error: received fatal alert: InternalError, labels: {} } ] }, labels: {}`
    at async GET (app/api/sources/route.ts:23:22)
  21 |     if (withCounts) {
  22 |       // Get sources with article counts
> 23 |       const sources = await prisma.source.findMany({
     |                      ^
  24 |         where: whereClause,
  25 |         select: {
  26 |           id: true, {
  code: 'P2010',
  clientVersion: '5.22.0',
  meta: [Object]
}
 GET /api/sources?withCounts=true&active=true 500 in 33048ms
Error fetching conflict statistics: Error [PrismaClientKnownRequestError]: 
Invalid `prisma.conflictAnalytics.findMany()` invocation:


Raw query failed. Code: `unknown`. Message: `Kind: Server selection timeout: No available servers. Topology: { Type: ReplicaSetNoPrimary, Set Name: atlas-r0e67z-shard-0, Servers: [ { Address: ac-fcgifqm-shard-00-02.fcvhot7.mongodb.net:27017, Type: Unknown, Error: Kind: I/O error: received fatal alert: InternalError, labels: {} }, { Address: ac-fcgifqm-shard-00-01.fcvhot7.mongodb.net:27017, Type: Unknown, Error: Kind: I/O error: received fatal alert: InternalError, labels: {} }, { Address: ac-fcgifqm-shard-00-00.fcvhot7.mongodb.net:27017, Type: Unknown, Error: Kind: I/O error: received fatal alert: InternalError, labels: {} } ] }, labels: {}`
    at async GET (app/api/analytics/stats/route.ts:14:22)
  12 |
  13 |     // Get analytics for the period
> 14 |     const analytics = await prisma.conflictAnalytics.findMany({
     |                      ^
  15 |       where: {
  16 |         date: {
  17 |           gte: startDate, {
  code: 'P2010',
  clientVersion: '5.22.0',
  meta: [Object]
}
 GET /api/analytics/stats?period=30 500 in 33076ms
Stats API error: Error [PrismaClientKnownRequestError]: 
Invalid `prisma.article.count()` invocation:


Raw query failed. Code: `unknown`. Message: `Kind: Server selection timeout: No available servers. Topology: { Type: ReplicaSetNoPrimary, Set Name: atlas-r0e67z-shard-0, Servers: [ { Address: ac-fcgifqm-shard-00-02.fcvhot7.mongodb.net:27017, Type: Unknown, Error: Kind: I/O error: received fatal alert: InternalError, labels: {} }, { Address: ac-fcgifqm-shard-00-01.fcvhot7.mongodb.net:27017, Type: Unknown, Error: Kind: I/O error: received fatal alert: InternalError, labels: {} }, { Address: ac-fcgifqm-shard-00-00.fcvhot7.mongodb.net:27017, Type: Unknown, Error: Kind: I/O error: received fatal alert: InternalError, labels: {} } ] }, labels: {}`
    at async GET (app/api/stats/route.ts:14:8)
  12 |       activeSources,
  13 |       pendingAnalysis,
> 14 |     ] = await Promise.all([
     |        ^
  15 |       prisma.article.count(),
  16 |       prisma.article.count({
  17 |         where: { {
  code: 'P2010',
  clientVersion: '5.22.0',
  meta: [Object]
}
 GET /api/stats 500 in 33103ms
Timeline API error: Error [PrismaClientKnownRequestError]: 
Invalid `prisma.timelineEvent.findMany()` invocation:


Raw query failed. Code: `unknown`. Message: `Kind: Server selection timeout: No available servers. Topology: { Type: ReplicaSetNoPrimary, Set Name: atlas-r0e67z-shard-0, Servers: [ { Address: ac-fcgifqm-shard-00-02.fcvhot7.mongodb.net:27017, Type: Unknown, Error: Kind: I/O error: received fatal alert: InternalError, labels: {} }, { Address: ac-fcgifqm-shard-00-01.fcvhot7.mongodb.net:27017, Type: Unknown, Error: Kind: I/O error: received fatal alert: InternalError, labels: {} }, { Address: ac-fcgifqm-shard-00-00.fcvhot7.mongodb.net:27017, Type: Unknown, Error: Kind: I/O error: received fatal alert: InternalError, labels: {} } ] }, labels: {}`
    at async GET (app/api/timeline/route.ts:36:27)
  34 |     }
  35 |
> 36 |     const timelineEvents = await prisma.timelineEvent.findMany({
     |                           ^
  37 |       where: whereClause,
  38 |       include: {
  39 |         article: { {
  code: 'P2010',
  clientVersion: '5.22.0',
  meta: [Object]
}
 GET /api/timeline 500 in 30304ms
